slideId,title,content
1,Willkommen,Willkommen bei unserem mehrsprachigen Präsentationssystem. Dies ist die erste Folie.
2,Einführung,Diese Präsentation demonstriert die Echtzeitsynchronisation über mehrere Sprachen hinweg.
3,Funktionen,Echtzeit-Updates • Mehrsprachige Unterstützung • Timer-Countdown • Host-Kontrolle
4,Wie es funktioniert,Der Host steuert die Präsentation während Clients synchronisierten Inhalt in ihrer gewählten Sprache sehen.
5,Vielen Dank,Vielen Dank für Ihre Aufmerksamkeit! Fragen?
