slideId,title,content
171,ПИТАННЯ #83,"Відповідь: Манассія поїдатиме Єфрема, Єфрем – Манассію"
172,ПИТАННЯ #84,"(1 бал) Згідно з Ісаєю 30:1, Господь, згадуючи про непокірних дітей, сказав, що вони проводять наради та укладають угоди, але не в якому дусі?"
173,ПИТАННЯ #84,Відповідь: Не в Моєму Дусі
174,ПИТАННЯ #85,"(1 бал) Згідно з Ісаєю 22:11, ви зробили водоймище для води Старого Ставу… . Де було збудовано цей резервуар?"
175,ПИТАННЯ #85,Відповідь: Між двома стінами
176,ПИТАННЯ #86,"(2 бали) Згідно з Ісая 12:2 вставите пропущені слова: “(...) Надіюся на Нього і не боятимусь, тому що моя сила і моя ________ - Господь! Він став моїм _________”"
177,ПИТАННЯ #86,"Відповідь: пісня, спасінням"
178,ПИТАННЯ #87,"(1 бал) Згідно з Ісаєю 26:21, за що, за словами Ісаї, Господь покарає мешканців землі?"
179,ПИТАННЯ #87,Відповідь: За їхні беззаконня
180,ПИТАННЯ #88,"(2 бали) Згідно з Ісаєю 7:14-15, якіми двома стравами харчуватиметься Син, що має ім’я Еммануїл? Будьте точними."
181,ПИТАННЯ #88,Відповідь: Молоком і медом
182,ПИТАННЯ #89,"(1 бал) Згідно з Ісаєю 1:17, кого, за словами Господа, має захищати народ?"
183,ПИТАННЯ #89,Відповідь: Сироту
184,ПИТАННЯ #90,"(8 балів.) Згідно з Ісаєю 9:5, заповніть пропуски: «Тому що Дитя нам народилося, – нам дано Сина. Влада на Його плечах, і дадуть Йому ім’я: ______ _______, _______ ______, _______ _______, ______ _______»!"
185,ПИТАННЯ #90,"Відповідь: Дивовижний Порадник, сильний Бог, Отець вічності, Владика миру"
